{
  "version": "1.0",
  "description": "Bulk stress test phase 4: styling, notes, and groups across 6 views",
  "idFiles": [
    "bulk-01-elements.ids.json",
    "bulk-02-relationships.ids.json",
    "bulk-03-views.ids.json"
  ],
  "changes": [
    {
      "op": "styleViewObject",
      "viewObjectId": "b-vis1",
      "fillColor": "#FFD700",
      "opacity": 100,
      "lineWidth": 2
    },
    {
      "op": "styleViewObject",
      "viewObjectId": "b-vis2",
      "fillColor": "#87CEEB",
      "opacity": 100,
      "lineWidth": 2
    },
    {
      "op": "styleViewObject",
      "viewObjectId": "b-vis3",
      "fillColor": "#90EE90",
      "opacity": 100,
      "lineWidth": 2
    },
    {
      "op": "styleViewObject",
      "viewObjectId": "b-vis22",
      "fillColor": "#FFB6C1",
      "opacity": 100,
      "lineWidth": 2
    },
    {
      "op": "styleViewObject",
      "viewObjectId": "b-vis23",
      "fillColor": "#DDA0DD",
      "opacity": 100,
      "lineWidth": 2
    },
    {
      "op": "styleViewObject",
      "viewObjectId": "b-vis24",
      "fillColor": "#F0E68C",
      "opacity": 100,
      "lineWidth": 2
    },
    {
      "op": "styleViewObject",
      "viewObjectId": "b-vis42",
      "fillColor": "#FFD700",
      "opacity": 100,
      "lineWidth": 2
    },
    {
      "op": "styleViewObject",
      "viewObjectId": "b-vis43",
      "fillColor": "#87CEEB",
      "opacity": 100,
      "lineWidth": 2
    },
    {
      "op": "styleViewObject",
      "viewObjectId": "b-vis44",
      "fillColor": "#90EE90",
      "opacity": 100,
      "lineWidth": 2
    },
    {
      "op": "styleViewObject",
      "viewObjectId": "b-vis62",
      "fillColor": "#FFB6C1",
      "opacity": 100,
      "lineWidth": 2
    },
    {
      "op": "styleViewObject",
      "viewObjectId": "b-vis63",
      "fillColor": "#DDA0DD",
      "opacity": 100,
      "lineWidth": 2
    },
    {
      "op": "styleViewObject",
      "viewObjectId": "b-vis64",
      "fillColor": "#F0E68C",
      "opacity": 100,
      "lineWidth": 2
    },
    {
      "op": "styleViewObject",
      "viewObjectId": "b-vis79",
      "fillColor": "#FFD700",
      "opacity": 100,
      "lineWidth": 2
    },
    {
      "op": "styleViewObject",
      "viewObjectId": "b-vis80",
      "fillColor": "#87CEEB",
      "opacity": 100,
      "lineWidth": 2
    },
    {
      "op": "styleViewObject",
      "viewObjectId": "b-vis81",
      "fillColor": "#90EE90",
      "opacity": 100,
      "lineWidth": 2
    },
    {
      "op": "styleViewObject",
      "viewObjectId": "b-vis106",
      "fillColor": "#FFB6C1",
      "opacity": 100,
      "lineWidth": 2
    },
    {
      "op": "styleViewObject",
      "viewObjectId": "b-vis107",
      "fillColor": "#DDA0DD",
      "opacity": 100,
      "lineWidth": 2
    },
    {
      "op": "styleViewObject",
      "viewObjectId": "b-vis108",
      "fillColor": "#F0E68C",
      "opacity": 100,
      "lineWidth": 2
    },
    {
      "op": "createNote",
      "viewId": "v-business",
      "content": "Business Layer Overview — Generated by bulk stress test",
      "tempId": "b-note1",
      "x": 10,
      "y": 600,
      "width": 300,
      "height": 60
    },
    {
      "op": "createNote",
      "viewId": "v-application",
      "content": "Application Architecture — Generated by bulk stress test",
      "tempId": "b-note2",
      "x": 10,
      "y": 600,
      "width": 300,
      "height": 60
    },
    {
      "op": "createNote",
      "viewId": "v-technology",
      "content": "Technology Infrastructure — Generated by bulk stress test",
      "tempId": "b-note3",
      "x": 10,
      "y": 600,
      "width": 300,
      "height": 60
    },
    {
      "op": "createNote",
      "viewId": "v-motivation",
      "content": "Motivation & Goals — Generated by bulk stress test",
      "tempId": "b-note4",
      "x": 10,
      "y": 600,
      "width": 300,
      "height": 60
    },
    {
      "op": "createNote",
      "viewId": "v-strategy",
      "content": "Strategy & Roadmap — Generated by bulk stress test",
      "tempId": "b-note5",
      "x": 10,
      "y": 600,
      "width": 300,
      "height": 60
    },
    {
      "op": "createNote",
      "viewId": "v-overview",
      "content": "Full Architecture Overview — Generated by bulk stress test",
      "tempId": "b-note6",
      "x": 10,
      "y": 600,
      "width": 300,
      "height": 60
    },
    {
      "op": "createGroup",
      "viewId": "v-business",
      "name": "Business Layer Overview — Key Components",
      "tempId": "b-group1",
      "x": 20,
      "y": 20,
      "width": 950,
      "height": 380
    },
    {
      "op": "createGroup",
      "viewId": "v-application",
      "name": "Application Architecture — Key Components",
      "tempId": "b-group2",
      "x": 20,
      "y": 20,
      "width": 950,
      "height": 380
    },
    {
      "op": "createGroup",
      "viewId": "v-technology",
      "name": "Technology Infrastructure — Key Components",
      "tempId": "b-group3",
      "x": 20,
      "y": 20,
      "width": 950,
      "height": 380
    }
  ]
}
